{
  "version": 1,
  "updatedAt": "2026-01-28T00:00:00Z",
  "weights": {
    "agency": 1,
    "strategic_depth": 1,
    "seat_imbalance": 1,
    "variety": 1,
    "pacing_tension": 1,
    "turn_taking_rate": 1,
    "interaction_rate": 0,
    "length_mean": 1,
    "length_variance": 1,
    "early_termination_rate": 1,
    "outcome_variance": 1,
    "coverage_actions": 1,
    "coverage_state": 1,
    "choice_value_spread": 1,
    "comeback_potential": 1,
    "skill_expression": 1,
    "degeneracy.loop": 1,
    "degeneracy.stalemate": 1,
    "degeneracy.forced-move": 1,
    "degeneracy.dominant-action": 1,
    "degeneracy.trivial-win": 1,
    "degeneracy.no-choices": 1,
    "degeneracy.non-terminating": 1
  },
  "weightNormalization": true,
  "diversityPressure": 0,
  "diversityWeight": 1,
  "preferenceWeight": 1,
  "preferenceCap": 0.25,
  "preferenceBootstrapSamples": 20,
  "preferenceBootstrapCap": 0.1
}
